,verdict,body,num_comments,score,upvote_ratio
48,not the a-hole,"Update: She got home from work and wants me to apologise 

TLDR: My job requires me to sleep early, partner prevented me from sleep. She's mad at me for pointing it out. 

So first some context. I work early mornings and have to be awake for work between 02:50am and 05:50am, so getting a good night's sleep is important to me.

My partner likes to watch TV before bed and won't do it in the living room as she likes to fall asleep to it too, we've only been living together 3 months and I could tell I was going to have to get ear plugs straight away. However, often I feel like the TV could be a little quieter as I can still hear it relatively cleary. Whenever I ask her to turn it down she responds with “I can't hear it” but what I think is happening is she just wants to keep it at a comfortable level. When the roles have been reversed I've turned the TV down to a level where I can just about here it so she can sleep, bearing in mind she never has to be up super early. 

So last night I wanted to start trying to sleep at 9pm, I put my ear plugs in and turned over. The TV though was very loud, at least for that time and when someone is trying to sleep. It was at the level I have it on in the day sometimes. I ask her to turn it down and she says “Can we not do this again” and I respond with silence to try and keep the peace. I try for an hour to try and get to sleep but I just can't, so I start playing with my phone hoping she'll get the hint. 

She asks me why I'm not sleeping and I gesture towards the TV. It's at this point she gets really defensive. Now I'm a little grouchy, but she seems offended that I'd even ask. The subtitles are on, so why not turn it down if you can read it? I didn't ask this as I thought she wasn't going to listen. 

I get up and say I'm going to go sleep on the couch, to which she becomes more agitated and eventually says she'll go sleep on the couch instead. While leaving the room she says it's not all about me and “what if I can't sleep!?” and slams the bedroom door. 
She eventually comes back in and goes to sleep, I'm still up as the altercation made me very awake. 

In the morning I'm leaving for work and I hear her ask me “no kiss?” (I usually kiss her before leaving) and I respond with a no, and walk out the door. 

So I get home from work and it's still morning, she's at her work. After an hour I go to turn the TV on to find the remote had gone missing, I thought maybe it had fallen beneath the sofa. To my surprise I find the laptop under there! It's at this point I knew she'd hidden the remote/taken it in her bag and she'd also hidden the PS4 remote. Then she messages me later on saying “Hope you're having a whale of a time with no remote or controller” 

SOME OF THE PETTIEST SHIT EVER! ",51,53,1.0
49,not the a-hole,"Just wondering if I'm the asshole for not believing my boyfriend has legitimate medical issues.  I've taken him to all his appointment and have heard his story change every single time. Also he will Google his own medical symptoms and has a different disease with his symptoms each week and of course he know more than any doctor, with his Google's Dr degree. Not to mention his mother has started coming along, and everything is worse case scenario. I feel like an asshole but also kinda don't care.",15,30,0.91
50,not the a-hole,"To start, this isn't me. This is between my sister (16 yo) and my father's girlfriend (Late 40s, unsure of exact age). I'm the brother (18yo) who is just trying to study for exams and shit's happening in the background.

My sister has always been prone to moon swings and stuff, and even moreso since our mother died a bit over 2 years ago. My dad has recently met his first woman since, he met her back around November time and she and her daughter (12 yo) moved in about 2 months ago. My sister doesn't like her, although the exact reason I can't pinpoint. Regardless, its not like she goes around picking fights, so its tolerable.

The issue normally comes when the girlfriend tries to tell my sister what to do in a 'strict motherly' way, which my sister doesn't like so she talks back, then shit kicks off. One observation I have is that my Dad's girlfriend has the maturity of a teenager it seems. Whenever anything goes down she leaves the house in a strop and drives around for a few hours before coming back, there are some cases in particular I'll refer to later.

Okay, so as a result of mood swings 'n' shit, the family as a whole have convinced my sister to go to therapy. My sister didn't want my Dad's partner (Who I'll call Anne) or her daughter to know (Especially not the daughter as they go to the same school. The daughter seems fine but she just didn't want her to know). Anne was getting pretty aggravated about being kept in the dark on everything, which is basically where the main issue lies. So my Dad told her, she in turn told her daughter despite being told specifically not to, then shit broke loose (Although my sister never found out). An example of Anne's immaturity is when my sister did something to upset her, nothing major by any means just some snide comment or something, and she spent the entire weekend giving her the silent treatment and generally acting like a bitch to everyone until my sister apologised. Like come on, you're acting immature for a teenager, let alone a fully grown woman, grow up.

So anyway, my sister went to councelling for the first time earlier today. Nothing particularly interesting happened, but she doesn't want Anne knowing, which I think is fair. So my Dad comes home from work, A asks him how it went and my Dad tells her that my sister doesn't want her knowing.  So Anne is now currently having another strop that she and her daughter feel out of place in this house and feel excluded. She's currently out on her drive now, so we've come to this position and I'm posting. I feel like my sister is refusing to tell her out of spite, but I don't think it should matter why she doesn't want A to know, its her information to give.

I'm looking for a way to resolve this issue with causing minimal harm to my Dad. He's a really great guy and A is alright most of the time, and he's just getting torn in half. 

This is probably the wrong sub, but I can't see any other subs that fit the bill and I could really do with some help on this.",20,40,0.99
51,no a--holes here,[deleted],11,32,1.0
52,asshole,"Firstly and most important, I never yell at her, verbally abuse or anything like that.

Thing is, I get annoyed and angry sometimes. Out of the blue. Like once or twice every week. I just need 20 minutes alone and I'm good. I have some mental issues, as does she. In fact, we first met on an online chat for helping with depression, anxiety, panic and other stuff like that. I actually managed to cut way down my drinking in the period we've been together, meaning I no longer drink by myself.

So we were talking on the phone, and she had this hysterical laughing fit while texting one of her friends. She wouldn't shut the fuck up, she was laughing maniacally for like 5 minutes! I was pretty anxious already, and it started to make my chest physically hurt.

I rudely interrupted her laughter, and asked her if I could call her back in an hour or so, this time with a dead serious and angry tone. Too bad, she didn't answer my calls anymore. Won't text me back. We are logged on a private chat 24/7 for just the two of us, in case we can't communicate via phone, and she logged off. It's been 2 days and no contact.

My anxiety is sky high right now. Today, June 12th, is ""Valentine's Day"" where I live, for fucks sake. I feel like a piece of shit.





Edit: update: she called me. We're okay now. :) I'm going to see a shrink with my brother and mom this week. We're all messed up. Hope it helps me. Don't want to lose her. I was seriously thinking about relapsing and downing a bottle of vodka yesterday.",16,30,0.94
53,petty,"My mother's cousin (my... second cousin, I guess?) is pregnant with her first child. I am not close at all with her. The last time I saw her was at her wedding, and the time before that was probably when we were children. She's maybe 10 years older than me. So someone in her family, either her mother or aunt (so one of my mother's aunts, my great aunts) threw the shower I believe. An invite was sent to my mother's house addressed to my mother, my sister (who is 19 and lives with my parents), and myself. I am and have lived in my own home with my fiancé for 2 years. 

I thought it was terribly rude that I wasn't sent a separate invitation. I understand that because I am not very close to her, she likely doesn't know where I live. I don't know where she lives, I didn't even know she was having a baby, and I don't know what's going on in any of my mom's aunts personal lives so I certainly don't blame them for not knowing that I've gotten engaged and moved. Given all of that, I would not invite them to something intimate like a baby shower. If we haven't spoken in so long that we aren't aware of each other's life circumstances, I don't think that's genuinely a person you want celebrating with you. I feel like it was just an afterthought, or even a gift grab. My mother's aunts (who sent the invitations) speak to my grandmother frequently enough that they could have reached out and asked for my address, although I think an invite was unnecessary at all. My grandmother and mother disagree that this was rude. I don't think anyone was the asshole... So I guess AmIPetty? Or was this rude?",27,36,0.88
54,no a--holes here,[deleted],16,27,0.94
55,no a--holes here,"So I'm graduating and I was getting gifts from all my various family members. My dad gave me this piece of wood that he had cut from a beaver chewed log. He had written congratulations on graduating on it and some other stuff with pen. He said it was very meaningful to him because he was on a spiritual journey when he made it. I tried to keep a happy face but I was a bit crushed. I still haven't gotten my Christmas present he promised me and his birthday present was just an egg carton, some soil, and some seeds. I don't wanna sound ungrateful. When he saw my face, he was crushed. So I pretended the reason I wasn't happy looking was because my eyes were burning. Am I the asshole for not being grateful?",34,56,0.98
56,not the a-hole,"Title might be a tad disengenuous. You be the judge!

 I tend towards extroverted, my husband tends towards introverted. On this particular Friday evening, my husband agreed to watch a particular movie with me. This is weird, because I am notorious for not having seen a lot of movies. However, I fancy the ones I have seen and remember are pretty good.

I suggested said movie because he said he wanted to watch a movie that I would like. Also, he tends to feel like he has to spend a chunk of money on us going out, which I feel guilty about, and he's a bit of a natural homebody. I don't want to be stressful -- though a movie might not be my first choice for every Friday, it's a great compromise since I understand he has to recharge some weekends.

I also have wanted to share this movie with him for literally many years, because it's one of my all-time favorites. So, I figure, low-stress, low-cost Friday night full of snuggles. Hey, if he's asking my opinion on what movie to watch, let's watch this one he's heard me rave about.

We also had friends online, on voice chat, playing some games. Fair enough, it's good to interact with people we both like! We do that most weeknights but there's no quota for friendship!

Both of us played a few games. After 5-ish, I stopped playing and started reminding him, 'hey, we're going to watch that movie I wanted to show you. Ok, another match, but, remember that we planned to watch a movie...'

Well, husband plays a match or two past our other friends, who stop playing and start leaving voice chat. We joke and laugh on voice chat about it, I hope gently. Our movie date was asked about, since I had said, ""hey, it's great to hear everyone but after this we're probably going to watch a movie.""

Eventually husband starts yawning and says he's going to log off/go to sleep. The two of us log off and I remind him that he promised to watch this movie, and that he usually games till he's sleepy and then passes out, regardless of plans made.  That he's promised to watch movies with me in the past and hasn't followed through. 

Hey gets mad because he's​ tired right now, and what is he supposed to do about it other than sleep. It seems unfair to him that I'm bringing it up at all. He starts the movie because he feels he now has to watch it, over my protests that now he will fall asleep and miss most of it/resent me for it, and I'd really appreciate it if he'd just save the energy to watch it sometime... And falls asleep midday through. I'm pretty mad at this point and say that it's no surprise he fell asleep and that's why I wanted to take a rain check but that I'm pretty disappointed in how the evening had gone, considering. He threw his glasses on the ground and I'm sleeping on the couch.

I feel like an asshole because a movie should never be a huge commitment. A movie should be on the lowest rung of priority on a Friday night. And I get that. From my point of view, a movie *was* on the lowest rung of commitment, but I saved energy for it.

From his point of view I get that he's tired, that he will fall asleep during this movie, and that when he's already tired it's probably unfair of me to berate him for not having saved the energy. I don't want to be that person who is super vigilant/quizzes people around me about the movie I made them sit through in the first place. But he suggested it, which makes me conflicted?

Of all the things I have energy for in my life, movies are on the lowest rung/are a fallback that I hope other people would be able to let go and forgive me for.

But I'm pretty upset that he has chosen to not save enough energy to follow through on the most low-energy plan I can think of, when he agreed.

At the same time, I totally get why friends in voice chat might take precedence. Friends > movie, for sure.

Anyway. Am I the asshole? Keeping in mind of course, and as I'm sure you know, that while I'm trying not to pile on the person I'm mad at, because I definitely could be in the wrong, I have probably biased this post strongly in my own favor.

Edit: oh shit I forgot a tl;dr!

Tl;Dr: I might be an asshole getting upset about a movie, because movies are a weird thing to prioritize on date night. But, it was my husband's suggestion that I pick a movie, so now I surrender to Reddit's judgement on relative assholery.",18,26,0.96
57,not the a-hole,[deleted],17,45,0.89
58,not the a-hole,"My partner has been gone for about a week, and came back home last night for a recording session with his band that occurred today. He'd told me that the session would be over around 6:30 or 7, and that we'd be able to spend the evening hanging out, which I was very much looking forward to, as he's going away for another week tomorrow.

This morning I asked him when I could expect he'd be finished, and he told me that it'd actually be sometime around 7:15, but he'd keep me posted. 7:15 rolls around, and he tells me that he and his bandmates haven't eaten all day, so they're going to go grab a quick bite, and that he'll probably be back around 8:45. Not ideal, but fine. At 8:30, he texts me and tells me that he's still eating, and I'm a bit bothered. I give him a call, and he tells me that they've actually gone to a sit down place rather than grab a slice of pizza, and that he'll probably be back at his place around 9:30. While he could have left at 7:15 when the session ended and grabbed some food with me, he said he'd prefer to save 15 bucks on an uber by getting a ride with his bandmates, who wanted to grab food.

Given that I work 9-5, this would leave very little time for us to spend with each other before he leaves for another week, I tell him that I'm pretty sad about A) having our hangs continuously pushed back to the point where we're basically just going to sleep together and B) this is the last I'm going to see of him for a while. At this point, he asks me what I want to do, and I say that I just want to spend some time together this evening before he leaves. He tells me that he'll tell his friends that he needs to leave soon so that they'll hurry up and finish their food, but obviously I don't want him to rush their meal on my behalf, so I ask him not to do that. He asks if it would be best for him to grab an uber to his place, where I can meet him, and I say yeah, that'd probably be ideal.

Problem is, I feel like an asshole for hassling him, but I also feel pretty strung along. I don't want to take away from his time with his band/friends, but I also want to feel prioritized and cared for. What are your thoughts on this situation, reddit?",22,40,0.9
59,not the a-hole,"Let me preface this by saying I work 25 hours a week as a janitor while I go to college. 

Prior to these messages it was 5 minutes past when I was supposed to leave but I stayed to finish moving some furniture back into a room. Two people I work with called off and he didn't care, and another girl didn't feel well so he let her leave. I'm consistently there every single day.

I also have pictures of this man sleeping at work so naturally him telling me to stay later aggravates me.

He came into the room I was in and said ""I need you to dust mop"" to which I said ""come on man it's already 5 minutes past my time and I'm just finishing up this room"". He then walked away and this happened.

https://imgur.com/gallery/fQD1C",16,26,0.94
60,asshole,"
Update: So the morning of the party, I was still deciding if I wanted to suck it up and go or just avoid the situation but my husband actually ended up having an arrhythmia episode and we ended up at the hospital for the day. When I check Facebook yesterday and see all of the pictures posted from the party I find out that not only did my old friend show up, she brought people with her. People that, even if we were still friends, I would never let her invite or let near any of my family functions and my mother and sister know that. But there they are having a good ole fucking time with my mother and sister. So at this point I really don't know if I am being an overly sensitive asshole or not. I do know that my feelings are very hurt.




Okay so after high school, I cut a lot of toxic people out of my life and that includes my so called best friend. We were friends from the beginning of high school up to about 2 years out of high school. I noticed that she did things that friends shouldn't do. Things like if I liked someone and she knew, she would end up sleeping with them and she only wanted to hang out if I promised we'd be drinking. It's been 4 years now since I've last seen her but this whole time, my mother and little sister have continued to not only talk to her but actually hang out with her. And I really didn't give a shit, I honestly thought it was kind of sad that my mom would still hang out and party with someone her own daughter cut out. I started getting upset when I found out that this person was going to my family events that I couldn't make and she was invited by my mother or sister because they knew I wouldn't be there. Now, my sister is having her open house this weekend and I found out that this person will be there. So I called my sister and asked her if she was really going to be there and my sister decided to throw a fit, crying about how it's her party and she can have whoever she wants there and that I'm being a child if I'm really not going to come because someone I don't like is going to be there. So I just said yeah, I'm totally the problem and decided that I'm staying home that day.  So am I really the asshole here?",38,67,0.95
61,you and lucy,"So last year I got to know a girl through a common interest, lets call her Lucy. She was great and we really hit it off early on, so much that I started crushing a bit on her. About a week later I get the chance to make a move while following her home from a bar. I am rejected as she makes it clear that she has a boyfriend and that she lives together with him. At this point I'm obviously a bit disappointed, but decided to continue the friendship as just good friends, and after a while this friendship feels pretty platonic.

Fast forward a few weeks and I become acquainted with Lucys boyfriend, a very nice guy who's also (somewhat) interested in the activity I met her through. We get along quite well, but never get to the point where I would call him a good friend of mine. We all go to the same university and meet eachother regularly.

Both me and Lucy finished our exams early this year, and because of this we had decided hanging out basically every day for the last two weeks (first for an event that lasted four days, later for drinking etc). We have a great time together, and I notice that I start having feelings towards her again, but surpress them, knowing she has a boyfriend. During this time her boyfriend seems rather absent, until one day he turns up at a party together with Lucy and gets drunk. When outside smoking he opens up to me and explains that he's been going through the death of a close family member just a month ago, that he had quit school for the time being and was having a really rough time. I try to comfort him as good as I can and I still feel really bad for him.

Here's where things get pretty shitty. Lucy is very touchy with guys in general, even with good friends of her boyfriend. Earlier when I'd been to parties with her and her boyfriend together he doesn't really seem to mind it. He's a very confident, good looking guy in general so I honestly wasn't too surprised that he hasn't felt ""threatened"" by this. Due to his absence at our parties for the last week though, and due to the situation he was in, I had decided I would not come close to Lucy physically as it felt really wrong.

One night we're at an afterparty together with some other common friends (once again without Lucys boyfriend) and we're all sitting/laying down in the hosts bed. We're all drunk, and Lucy starts laying very close to me. I started feeling uncomfortable and decided leaving the bed and started talking to some other friends in the living room instead. after the party Lucy and I walk home together, and we end up talking about the episode and she seems a bit annoyed at me. I tell her ""Sorry, I know I'm being weird and I know that you mean nothing by what you're doing, but I feel really bad about it anyway"". She tells me it's OK and that she understands, and we split up for the day.

Two days later we end up at an afterparty at my house, now with the boyfriend present. I get extremely drunk and end up passing out in my bed with Lucy and another friend sitting beside me. It turns out that Lucys boyfriend was mad after arguing with one of his friends about something unrelated. This had ruined the mood and everyone except Lucy left the party without me knowing (laying drunk in my room). I wake up next to her in my bed and she starts cuddling with me. This time I end up obliging. I knew it was wrong, but I also have a crush on her and had a weak moment. She starts looking at me and tells me that she's in love with me, and I tell her I feel the same way. We kiss for a second, but I immediately feel really shitty about it and tell her to leave. On her way out she tells me she's sorry, that I shouldn't worry about this and that it's not my fault, but I'm very unsure about the whole thing personally.

Sorry for the wall of text, but how do you guys feel about this? Am I the asshole for letting things go this far?",22,77,0.95
62,not the a-hole,"No, I don't mean ""I didn't get [X] waaaahhhh"", I mean this.


A few years ago my parents were planning out my family-only birthday party. One of the people attending is my cousin who's son is allergic to 95% of anything you can imagine. I wanted a chocolate cake. ""Your cousin can't have chocolate, pick white"", my dad said. ""It's my birthday and I can't have a chocolate cake? We could just get him a smaller cake or cupcake or something or at least that for me"", I said back. ""No, that's too much food, we'll just get white"", he said. What was the point of asking then if I didn't have an option to begin with? Then for food I wanted BBQ. Guess what? ""Your cousin can't have most of that, we need to have things he can eat"", my dad said. At this point, I'm irritated. ""Then why are you asking me what *I* want, if it's just about what *[cousins name]* needs"", I asked back. ""Because it's *YOUR* birthday, you pick what you want"", he said. Not caring anymore, I suggested the most blandest food you could have at a party. The day of my birthday arrives and the food spread is pretty much a thanksgiving meal and my cake, my personal favorite, at my request, was a bland white cake with no icing and a picture that goes on top that would have been the heading of the cake. My cousins show and the mother of Mr. Allergic To Everything brought him his own fucking pizza. Like, a straight up large pizza hut pizza and mcdonalds because apparently that's the only things he can eat. He ate only that and wanted nothing else, not even cake. My dad then later tells me that I probably could have gotten the food I wanted. *scene of me eating a bland cake slice with a plastic knife like a fucking neanderthal*


People who I told this to online think I'm an asshole for wanting things I wanted on a day about me when my cousin needed to be put first before me.",29,60,0.95
