,verdict,body,num_comments,score,upvote_ratio
37,call CPS,"We had new neighbors move in on the right hand side of us(if you're facing the street) about a month and a half ago. A young couple (somewhere between 26-31) and their two young boys (ages 4-6), plus 3 dogs.

We live in a quiet part of town, the houses are modestly priced for their size and sit on tree-lined streets, both a high school and an elementary school are within walking distance, kids ride their bikes down the sidewalks(it is not safe to ride them in the street, we sometimes have speeders) and play in their front yards without fear of unsavory characters or flying bullets, the metro station is within walking distance, there's a park also within walking distance; its the perfect type of place to start and grow your family.

After talking to them, I learned they came from a gated manufactured home(see also: mobile home) community (coincidentally, the same one my ex just moved into, so I know it well.); where they come from security patrols regularly, kids play outside in the street, and the speed limit within the community is a strict no-nonsense 10 MPH(you WILL get caught, you WILL receive a ticket), the  lots are about 3 feet apart so if you so much as SNEEZE your neighbor knows about it, and there's absolutely no parking on the street. 

Their old community was basically the real life equivalent of a ""tutorial level"" for a life simulator game. 

When they first moved in, I didn't notice anything out of the ordinary. It's very easy to hear what's going on over there because they don't have very much furniture, and nothing on the walls. The adult male has an older model mustang in bright red. As a car girl, I was impressed, until I heard him start it and realized he'd taken the muffler off. On purpose. **Strike one.**

Then, one day I'm coming home from work (around 8 pm, so it was starting to get dark), their moving van is parked in front of the house. I park my car, and I'm sitting in my car, with it turned off and scrolling through my phone when out of the corner of my eye the cab of this moving truck lights up, the passenger side door opens and a child no older than 4-5 clumsily climbs down out of the cab of the truck, he stands in the street for a couple minutes (door still wide open. We occasionally have speeders down my block, no kid is safe in the street) and looks down the street, and then at me sitting in my car. He has a pacifier(binky, dummy, whatever you like) in his mouth and he's chewing on it. He then walks around the door, and pushes it closed with all his might(but it doesn't close, and the light in the cab stays on), he walks up the driveway of his new house, and disappears around the back of the house. Its then that I see his older brother(6-7) is sitting in the cab of the truck, in the driver seat, pretending to drive. He gets in and out of the truck several times running around  in the street, to the passenger side of the truck, climbing into the truck, climbing across to the driver side, then doing it all over again. Eventually the older boy goes inside too, and the moving truck sits there, cab lights on, both doors slightly ajar. I wait; thinking someone is going to come close the doors(surely people know where there kids have been?), it stays on all the way after I shower and change my clothes and I am heading out for the night with friends. I walk over, close the doors, and make sure the interior light turns off, get in my car and leave. Letting your young children play inside of a truck and in the street unsupervised? **Strike two.**

The next morning, I'm awoken a few minutes before my alarm to a man SCREAMING in obvious rage; his voice is low, guttural, and dare I say scary, I've never heard a man talk to ANYONE that way (my own father is rather soft spoken, and so are a lot of men in my life), he's yelling at someone to ""just leave it the fuck alone, stop touching it"", and when I hear the answering cries of a small child, I peek out the window in our kitchen and see him wailing on the youngest boy with a closed fist. There's an open moving box on the driveway near them, and some foam puzzle pieces (the big toy ones, for the floor) are strewn about. I'm a little shocked, and part of me *knows* that he shouldn't be hitting his child that way. But, I am not a parent, and don't feel it's my place to say anything. I have to leave for work, so idk what the conclusion of this particular incident is. Beat your kids in the driveway for just being kids? **Strike three.**

Over the past couple of weeks there's been more incidents such as these, and other incidents as well. 

- Screaming matches between parents (""Are you really going to sit on your ass and not bring up the laundry so I can fold it?!"" -a presumed loving wife to her lovely husband). I had a friend over and we were sitting on my front porch just talking, and the screaming was so loud we couldn't even hear each other talk.
- I thought it was a little weird that they left all their lights on, and left the doors open and the A/C on, but figured that they knew what they were doing. They got their electric bill after a month of living there, and Dear Old Dad almost had a coronary. At their old community the way their electric bill was calculated was that the whole park got charged one fee(by the electric company), and it was devided by the number of lots that were occupied at the time, meaning it wasn't unheard of for a family of 4-5 to have 45$ electric bill no matter how much they blasted the A/C, or left lights on. It's not like that out here in the real world, where your electricity is your responsibility. 
- The male counterpart getting in his (NOISY)mustang and peeling out of the driveway doing 45 to ""cool down"" after every argument. Considering there's a fight at least twice a day....
- the children misbehaving within the home and getting screamed at/punished. Seriously, I always know when they are sitting down to eat dinner because it's always a screaming match between the parents and the kids, with plenty of threats, swearing, and punishment. These kids can never escape the table without an ass whooping.)
- the dogs barking for some unknown reason (not a problem with me, we have a rottweiler, he barks too), and both adults full blown screaming at, and hitting all three dogs to the point that the dogs are crying/coweri away from them. 
- the older boy has some sort of anger issue (I wonder where he learned that from), and if he gets frustrated at all or doesn't get his way, a screaming match will ensue.  Just wordless, seemingly endless, piercing yells because he cannot think of any other way to relieve his stress other than screaming. 

Today, I don't work until 4pm, so I've been home all day. During lunch, I heard what I thought was another screaming match between the boys break out next door, and then heard the father laughing. While cleaning the kitchen, I listened to what was being said (oh, this is also not hard to do because since getting their electric bill, they now leave every window open instead of using The A/C. If I stand in my kitchen, I can hear the dad's Pandora playing on his cell phone. I am privy to every. Single. Conversation. that happens within that house, whether I want to hear it or not.), and the dad had a toy the older boy wanted. The dad was playing the ""up high, down low, too slow"" high-five game, and if the older boy could hit his hands, he could have the toy. Clearly an adult is going to win this game every time, and every time the boy lost, he would let out a scream that could wake 3 centuries worth of dead folks, getting louder and louder as his frustration grew. Eventually, the boy was crying in frustration, and his dad was just laughing his ass off, loudly. Probably the only time I've ever heard the guy laugh. While not abusive, still he's being a fucking dick, and the kid's screaming had my anxious (and old) rottweiler pacing back and forth and panting. 

**TL;DR: my new neighbors are trailer trash, the father beats both his kids and all three of his dogs. His wife is a giant cunt who never watches the kids and let's them play in the street. There's constant screaming matches that have disrupted my sleep, and caused friends to look at me like ""wtf is going on over there?"" The constant screaming is making my own dogs anxious. Would it make me an asshole to file a noise complaint?**",28,41,0.86
38,not the a-hole,"A few things to start, I am a stay at home mom, I cook, I clean, I home school. I do the laundry for all of us, which includes washing, folding, ironing when necessary, hanging up, and putting away, although I have started my 11 year old helping with it. All I ask is that whatever is dirty goes into the laundry hamper. My husband, for some reason, has a serious problem with putting his clothes in the hamper, he just drops them wherever he takes them off, whether it's the bedroom, the bathroom, or the living room. So I stopped washing anything that wasn't in the hamper. He sent me a text today and asked if I did laundry because he was out of socks and I told him that I had but he didn't have much in the hamper and now he's mad at me. Should I be expected to round up all his laundry from all over the house? Even my 11 year old knows that if it's not in the laundry hamper it doesn't get washed.",22,36,0.95
39,not the a-hole,"I recently received a workplace promotion and I'm finally earning enough to save some money in London whilst me and my girlfriend ""Natalie"" live together.

Two weeks after I received the promotion, against my wishes, Natalie goes for a job interview in Cornwall (following her dream) and gets the job, so now we're moving to Cornwall.

When I said I would wait until I got a decent job in Cornwall before I resigned from my nice new job Natalie threw a fit and basically said that it means we should break up if I don't want to move immediately.

Given that in London, on my own, I would probably start eating into my savings to pay the rent, but mostly because Natalie was so upset, I handed in my notice at my nice new promotion and I'm leaving after only 3 months on the job.

Here's the thing:  upon arriving in Cornwall Natalie expects me to take the first shitty job available, even though on GBP£40,000 she will have more than enough money to support us both.  

Natalie refuses to allow me time to find a decent job.  She's threatening to leave me because of my ""attitude"".  She expects me to get a job as a shelf-stacker or bar man having just resigned from a semi-senior role in IT and take a GBP£30,000 pay cut.

Reddit:  Am I The Asshole for wanting to take my time and find a decent job?

Context:  Me and Natalie have been together for 6 years and are engaged.

**TL;DR:  Girlfriend gets new job far away -> expects me to move from a good job into a shitty job immediately after moving even though she can support us both.  I'd rather take my time until I find a good job.**",39,36,0.87
40,not the a-hole,"I met this girl on tinder about a year ago. We texted over the summer for a bit but every time I tried to schedule a date to hang out, she would say she was busy and she never tried to schedule an alternative time so I assumed she just didn't want to and stopped texting her. She messaged me again when Uni started back up, and we sort-of dated for about a week before she broke up with me. 

Since then we've been on-again off-again friends, though only really over text. We hung out for a bit after breaking up, but over Christmas we got into a row and never really starting hanging out again. After end-of-year exams she messaged me again asking to go out for drinks. However, every time I tried to schedule a time she rejected me without suggesting a new one, so I assumed she didn't actually want to. I tried being direct, but she still made no attempt to follow up on her offer to get drinks.

So I've just stopped texting her. Without telling her why or so much as a goodbye.

I feel awful about it, though. Whenever people do this to me it just tears me apart, but I can't help but feel like telling her would be worse. And I'm afraid I'm just being oversensitive. 

I spent high school holed up in my room learning Java, so I know fuck all about navigating social situations. Am I being an asshole? And if so, is there a better way to stop being friends with this girl?",11,33,0.93
41,asshole,"Ok so I came home from work and my Roommate had been watching my dogs. He tells me ""Hey your dog ate something a few hours ago and has been choking ever since."" So i gave him water, tried to feed him ect...My dog was eating and drinking but was having a hard time swallowing and was still choking. Then he threw up everything he ate and drank a few minutes later. Then my roommate tells me ""it might have been my rubber bracelet, I cant find it"" (keep in mind this would be the third time my dog ate something of my roommates because it was left on the floor. And they were things that could harm him. Sock and large magnet) so then i took my dog to the vet where they said they will try an x-ray and a scope down his throat but there might not be anything they can do. So im upset and basically in tears that my irresponsible roommate basically let this happen. So when i get home i told my roommate that if my dog dies because of his mistake then he has to move out. ",28,37,0.91
42,not the a-hole,"Me and my girlfriend rarely go to bars but occasionally we'll go to this one quiet place with really nice flavored beers. While we were eating dinner at a restaurant I suggested that we go to it. She said yeah, and I said I'll buy her a beer to celebrate something.

Everything at the bar went alright until we were gonna order the second round. I said I was gonna get another and asked if she was going to get one too, she asked if she could. I basically said ""well it's your money"", and she got very upset with me. We ended up leaving soon after because of it.

She kept going at me with many versions of ""that's so shameful, you couldn't spare a little money for a small beer? You were already treating me to one! You're so greedy!"", to which I replied with ""I offered to buy you one, I didn't say I was buying for the whole night"". She wouldn't let up with it and acted as if it was some moral tragedy that I was going to have a second beer without buying her one. We don't share finances or anything and money is tight for both of us.

We kept fighting for the whole night. She pretty much just kept repeating ""How can you be so shameless? To order another big beer for yourself without ordering me a small one! I'm ashamed for you!"". I kept chalking it just a difference of opinion that isn't really a big deal, but she just kept being so over the top about it and drawing conclusions like she thinks I'll restrict finances in marriage (but no way in hell I'm marrying her without her having her own income after this) and talking about how others (friends) have treated her to more things and stuff

I think she's the asshole here because I shouldn't be expected to pay for more than I offered to pay for. I also feel she was ungrateful and spoiled for fighting about it with me the entire night.",33,37,0.96
43,not the a-hole,"Seems like every time we pay for some kind of tour, some parents bring in some screaming brat, then do absolutely nothing about.  At Christmas the whole taste testing in Hershey (which we had to pay for) was ruined because TWO families brought in their brat kid who screamed throughout, making it not only unnerving, but impossible to hear the presenter.

Last night at the Titanic museum we had a guided tour, paid extra for it in fact, and the presentation was nearly impossible to hear over the little screamer.  My wife could see me starting to
 boil.  Several of the tourees grumbled loudly.  Brat continues.  The tour guide started actually starting the presentation before the stroller was pushed into the room so the rest of us could hear something.

I'm of the opinion when you pay for an experience, there is an obligation to not ruin it for the other attendees.  Wife disagrees.  AITA?",18,52,0.95
44,50%asshole,"My wife and I have 3 bank accounts: hers, mine, and family.  95% of our income goes into the family account which covers all family expenses.  Our personal accounts are for whatever we want to do.  I have more money in mine that she has in hers from savings, inheritance, and side jobs.  Admittedly, I spend a lot on frivolous things, like booze and poker.  

Recently, the wife wanted to join the gym so the kids can go to the pool.  We have done this in years past.  With all the fees it ends up being about $400-500 for the summer (comes out of family account).  We have gone on average of about 4-6 times/summer for around $100/2-3 hour swim. This year I said it wasn't worth it as they swim at various summer camps events.  She is now sullen as I put the nix on the idea.  She cites that I'll spend $200 on poker and lose it or go out with friends and run up a not insignificant bar tab (again, all with personal money).  AITA? Should I just give in?",22,39,0.92
45,not the a-hole,"Today my girlfriend was upset she wasted $8 on a skirt she couldn't wear for various reasons. We were originally going to go out to eat and take a walk, but since she was torn by this she had me come to her place. I told her I was gonna buy the food first and that I'd be 20+ mins. She responded passively aggressively and acxused me of only going to her part of the city to eat. We argued a bit, I didn't buy food because the argument went on too long, and went to her place.

She started crying about wasting the $8 when I got there and I did my best to comfort her. After about 40 minutes I glanced at my watch during a hug to see the time and then adjusted the position on my wrist slightly. My girlfriend jumped back a bit and asked me if I was looking at the time. I said yeah and she bursted out crying.

I checked the time because I was anxious about missing the tram I needed to get home without a 1+ hour walk after midnight. I explained this to her and she kept crying really hard and accusing me of not caring for her and etc. I tried to comfort her again but it just got worse.

Eventually I remarked that I didn't want to walk home alone so late at night and referenced a previous argument we've had because I left her a minute before we arrived at her apartment building (because she was acting awful at the tinr). She went into absolute hysterics. I'm not kidding when I say this is the absolute loudest I've ever heard anything cry or even scream out in pain. I was sure she was going to wake up the entire apartment building including her mother (who takes sleep medication and wears ear plugs). I'm almost convinced she was trying to be as loud as humanly possible. I know this is a weird thing to focus on but this was genuinely disturbing. She literally sounded like she was dying.

And I know ""I'm almost convinced my girlfriend was trying to cry as loud as possible"" and saying it nonchalantly really makes me sound like a piece of shit but I have no other explanation for it. I'm not exaggerating at all. She has taken the death of family members better. I almost suspect she was being as loud as possible just to wake up her mother and put me in a very uncomfortable situation. All in all I feel this was a gross, gross overreaction and if intentional despicable. I don't think she WOULD do it just to get back at me but I don't know how she could've been so loud without intentionally trying to wake people up. Lile she was sitting there mouth wide open absolutely no attempts to cover her noises and generally not wake up the building (she can hear a cough from the neighbors).

Anyway understandably - at least to me - I panicked the fuck out. She sounded like she was dying. At first I was like ""ok shit I'm leaving"" because I was clearly not helping the situation at all and generally panic. After the first few seconds I decided against it for obvious reasons.

She... ""calmed down"" a bit after that. Still crying profusely because I was worried about missing the tram. It was a bit before this point where there was no way in hell I'd be able to make the tram. Talked a bit yeah yeah she's still pissed I looked at my watch, etc etc, still maintaining crying for hours over wasting $8 and me looking at my watch wasn't an overreaction.

Several times during I brought up that I didn't want to walk home so late. To which she replied that she would've paid for a taxi for me. Which is bullshit because she just got done crying for 40 mins over wasting $8. Mind you $8 that she likely could've gotten back from returning it and if not that reselling it. And she seemed almost offended at the idea that me not walking home alone late at night on mostly empty city streets was more important to me than consoling her over $8. Like yes, my satety and arriving home before 3am are more important than your minor inconvenience

If I seem cold or uncaring, I'm really not. Just tired and not in the best of moods and walking home right now. ",28,45,0.96
46,no a--holes here,"Hi Reddit

My BF is getting back from a work trip tonight, and he's been away for a while so I figured it would be nice to pick him up from the airport. He missed his original flight which was going to get in at 7:15PM, and had to catch another one getting in 12:30am (ugh). When it came time for him to depart, he told me that the plane was about half an hour late in taking off, so he'd be getting in at one (uuuuugh). I say no biggie. Not ideal, but ok.

I go to check the flight schedule to see what's up, and lo and behold, his flight is actually delayed by more than a full hour, so it looks like he's scheduled to get in at 1:45. He's in the air, and it'll be a couple hours before I head to the airport, but I feel like A) he should know that he's going to be delayed quite a bit longer than originally expected and B) should probably try to contact me about this? He's on a flight that definitely has wifi, so he's more than capable. I sent him a few chagrined messages when I found out asking why he wouldn't try to let me know what the actual delay was, and I feel like I might have been too harsh. At the same time, I'm majorly going out of my way for him and feel like he should at least be making some attempt to keep me in the loop about this. It seems like he doesn't seem bothered that I might be sitting in my car at arrivals pick up wondering where he is.

Am I the asshole?",17,30,0.9
47,asshole,"I planned a birthday party for my fiancé at our house. We live with ""Roommate"", our friend, who has a fiancée who is a very picky eater. Let's call her ""Picky.""


Picky is a juvenile/sheltered eater: plain chicken and rice and pasta are her main meals, takes lettuce and tomato off her burger, minimal seasonings and veggies, didn't know what a kiwi was in person and never tried hot chocolate until she was well into her 20s. Weird mix. I can never guess what she will or will not eat because it varies wildly. She has no medical dietary restrictions. Despite this she never makes a fuss of her food out loud, if she does its a meek whisper to Roommate. She's a nice girl who fits with our friend group well.


Back to the birthday party. Most guests are mutual friends with Roommate and Picky too. The time comes to order pizza from my fiancé's favorite pizza place where we crowd around the computer looking at their menu and deciding what toppings to get. Normal pizza topping decisions are discussed and made by all. (If it matters, I think we decided on a veggie, a pepperoni and sausage, and a cheese.)


Right before we call to order, Roommate has us add a specific chicken finger meal for Picky. I do not recall the exact exchange of words. This is for her only, not to share by the other guests. She could have expressed her pizza preferences along with everyone else, but didn't. I don't think she had any pizza other than sampling a bite at Roommate's coaxing.


I paid for the entire order myself as it was the main food for the party. However, I and my fiancé both felt I should be paid back for Picky's specific meal.


Later in the night Roommate and I are alone in the kitchen where I matter of factly ask him if he/Picky has cash for her meal or if he'd Venmo to pay me back. (I worded it this way on purpose to avoid any sort of ""Where going to pay me back?"" awkwardness) He paid me back and that was the end of it. I had no resentful vibes from him or Picky at all for this, but then again they're both very non confrontational and could have grumbled about it in private. Did they complain or didn't they? Are they secretly annoyed by it? I'll never know.


But it's been in the back of my mind since. So, am I the asshole for not paying for her meal?",34,49,0.87
