,verdict,body,num_comments,score,upvote_ratio
63,not the a-hole,"I was eating out with some people. A territorial asshole fowl constantly came closer to our outside table. After a few minutes, it was really close and snapped my leg hair and constantly spread its wings like ""come at me, human"". 

It made weird noises and didn't stop. The others found it hella funny, but it was extremely annoying. I couldn't really eat and it hurt, just try pinching your legs and pull the hair there. 

It was quite a task but I grabbed it and ran to the fence with it, then threw it over. It even hit my face and the damn bird made a ruckus. The waitress called me animal abuser, other guests **took the fucking bird's side** although many of them saw it being a fuck. I tried to defend myself, but she had none of it and told me to leave. I didn't have to pay, so that's okay, but hell, what am I supposed to do in such a situation? 

The people with me told me I overreacted and just should've let the bird be. Also, they kept me waiting until they finished their food, I'm not mad though. I'm mad that I was the monster when a damn goose attacked me. 

Am I seriously the asshole for getting rid of an abuse goose??",35,51,0.95
64,not the a-hole,"Ok, so My ex and I broke up like a week ago. We broke up because she has serious trust issues, and swore up and down I was cheating on her (which i wasn't, I'm not a cheater.). I got tired of feeling like I constantly have to prove myself to her for nothing. (I  also know that when a woman constantly accuses you of cheating, and you know you're not, then they're probably the ones cheating.) 2 days after that, she came over and we talked so she could have closure. I guess she construed it as I want to get back together, which is far from the case. So she wants to give me a second chance that I didn't ask for. So this morning, she calls me and asks if I want to hang out with her, I say no, I have things I need to take care of. Rent's due and such. And she goes on this tangent about how I'm an asshole and how she was so in love with me, and I betrayed her and all this hoopla. Mind you, we only dated for 2 months, when last year, I didn't even know who this girl was. And she's in love with me? No fucking way. Anyway, Am I the asshole here?


TL;DR Ex gf wanted to hang out, I didn't. Now I'm a heartbreaking jerk of an asshole because of it. ",25,39,0.96
65,asshole,"Going to try to make this short and sweet because I hate walls of texts.  I live across the country from my daughter from my first marriage and have for the last about 6 years.  She is about to turn 13.  She has come to visit me once in those 6 years.  Since that time she will not come back despite my asking, begging, bribing, etc.  She has stated she only wants to see me and not my wife and our 2 kids together.  I have refused these demands because I feel that I should not legitimize this behavior.  I feel that she should not be acting jealously and should not be trying to pretend my wife and kids don't exist, especially when she has fully accepted her mother's new husband and his kids as her own siblings. AITA?",89,45,0.88
66,META,"It is so frustrating when a submitter gets upset that the conversation isn't going his way and makes the whole post disappear without warning.  But we think we owe it to our subscribers to do what we must to make sure a post they are interested in exists at least until a consensus is reached.  So we decided to add this rule for posting here:  



* **DO NOT delete your submission** after the discussion has begun, even if it's not going well for you. The point to this sub is to start discussions that people will want to check back in on to see what consensus was reached. If you erase a discussion because you don't like the way it's going, that is extremely frustrating to everyone who has already taken an interest in the topic. We encourage submitters to use throwaways to maintain their privacy, but deleting a discussion is unacceptable. Violators will be banned. ",31,261,1.0
67,not the a-hole,"I work in a company that recently got into trouble for waste/fraud in terms of hours. They now closely watch our time punch ins, door scans etc. 

The closest bathroom has one toilet. The second closest is about 6 mins away.  I waited for 18 minutes (he was here before that but I was there for 18 minutes) before I asked if he was going to be awhile.  That's okay if he is, I just need to know for my job and I got to shit. 

He replied ""OKAY WOW. I'm almost done"" and immediately began the process of leaving (I could hear him stand up etc).  Once he left he stood and glared at me.  

AITA?

",13,44,1.0
68,asshole,"I have friends who keep referring to their children's daycares as ""school"". These daycares go so far as to issue ""report cards"" (daily feedback) for INFANTS. While I understand it is done tongue-in-cheek, it grinds my gears, and I wanna go off on everyone. Biiiii****, stop this madness. All babies learn, whether sitting in a daycare or at home. Stop pushing our children further and further into the ""rigorous education"" machine. Emphasize play based learning. Stop making babies learn SIGHT WORDs. It might be ""cute"" saying your babies are in ""school"", but it feeds the problem we're facing right now, where we overwork our children, turning them into stressed out, regurgitative robots. We are pushing our kids into formal education earlier and earlier, and giving them more and more homework, to their detriment. Studies have shown children who start kindergarten at a later age have lower rates of attention disorders. Can I just tell them all to knock it the F off?! ",31,65,0.92
69,not the a-hole,"Kids from the nearby high school keep parking in my apartment lot and hotboxing their car. They're right outside my bedroom window. A few times one or several cars have parked and the kids drink beer too.

This doesn't bother me too much but does bother my wife. 

Tonight when I saw one of their cars I walked up to them and told them they had to stop and that we call the cops every time we see them.

I feel kinda like I just told some kids to ""get off my lawn"". AITA ??",32,40,0.93
70,not the a-hole,"I am back in my home state for the summer after finishing my first year of college. During the past year I started dating a girl who, in my opinion, is really just the best. She's super cool and kind and frankly hot. I didn't have any kind of romantic life during high school (I lost my virginity to this girl during the first semester) so this is a pretty big deal for me.

So now I'm back home and I find myself talking about her a lot, and sometimes pretty much bragging. I know it's not cool to just brag about a relationship but I don't do it that often, and when I do I try to phrase as sort of a joke. I've shown them I think like, two pictures and mentioned that she's a contortionist a couple times. The second to last time my friends, friend #1 mentioned to me that friend #2's girlfriend is feeling kind of inadequate because of how I talk about my girlfriend. I tried to tone it down next time we hung out but I did end up bragging once (I do feel really shitty that I still talked about her after knowing that someone is feeling down on themselves) 

Now my friends keep making these jokes (""oh, did you hear that OP's girlfriend is a contortionist?"" ""oh wow no way"") and I can't tell if they're actually upset. We tend to rib on each other but these jokes are really making me feel like an asshole. I know I shouldn't be talking about her so much but this is still a pretty big deal for me, especially because she's been helping me feel more confident about myself and stuff.

Am I the asshole? Are my friends really upset or am I being overly sensitive?

EDIT: It's also worth noting that's we've only hung out three times since I've been back, although I did mention her in group chats two or maybe three times while I was still at school.",20,37,0.97
71,not the a-hole,[deleted],30,65,0.89
72,not the a-hole,[deleted],41,40,0.86
73,not the a-hole,"I have pretty moderate to severe social anxiety to the point where I'm extremely uncomfortable in any social situation with people I'm not close with. Despite that I've tried my best to combat it and go out of my comfort zone from time to time. My girlfriend knows this. In fact, a lot of my ""going out of my comfort zone"" moments were for her. Namely, moving to her native country where I don't even understand the language, meeting her parents (where one of them doesn't approve of her dating a foreigner), and meeting her friends for an entire day.

Today I was going to meet up with her after she was done meeting up with her friends. While I was on the tram there I asked if she was alone or waiting with her friends for me. She kept avoiding the question and generally acting annoyed at it. I got off the tram in a panic because I was especially anxious today.

She eventually answered and then asked what I would do if she wasn't alone, all in a very condescending and annoyed tone. I admitted I would not be able to show up and I would like her to make an excuse to meet me alone in that scenario. 

She got angry with me, continually asking me why I can't ""function like a normal person"" and all that. I was hurt by that greatly. We went back and forth a bit, I told her I didn't want to see her. She kept hounding me and asking me why I can't act like a normal person. I went back to my place, and she apologized specifically for hurting me (her way of saying ""I want you to feel better but I don't feel I was wrong at all"") but then kept arguing on about how I should be able to function like a normal person. I basically told her ""I want a genuine apology or you can fuck off"" and that I don't want to be with someone who would say things like that to me fully knowing of my social anxiety.",24,41,0.93
74,not the a-hole,"I love my bf. But he sometimes has a pretty unpleasant odor.

He has stopped wearing any kind of cologne because he wants to only put natural products on and in his body. I understand this. Unfortunately, this also means that he doesn't wear deodorant.

I don't know if he can smell himself but I can and sometimes his odor is pretty potent. He had a big launch event for a company that he works for two months ago and when I arrived to this big event where he was networking, he reeked. REEKED. He is very sensitive and gets very upset when I bring up issues. I can't tell if he is simply hard on himself or if he is being purposefully or inadvertently manipulative so that I stop bringing things up. For instance, me making a simple request turns into him having a meltdown about being the him being the most terrible person ever. 

So I attempted to approach the stinky issue very delicately. He was training for a bike trip and decided to start biking to work. I suggested that he maybe start wearing deodorant so as not to offend people with his odor when he arrives to work after the workout and throughout the day. He was VERY upset by my suggestion. I clarified that I am not suggesting this out of malice but mostly out of a pursuit for professionalism and out of concern for him. He eventually took my comment as it was intended. Since that time we purchased some natural deodorant. I've experimented with it myself and it works pretty well but I'd noticed that boyfriend hadn't used it. The other day after we'd both showered I offered him some and he put it on. I even remarked at how good it smelled on him and how much I liked it.

Well, a few days later, I guess he skipped a shower for a day. His boss is a little...hipstery and takes pride in only showering once every two weeks. Somehow, that works for his boss as he doesn't seem to smell. On a day where my boyfriend was kind of stinky his boss made the comment that it was getting hotter and that maybe they'd both need to start taking more frequent showers. My boyfriend laughed about this but I was really mortified for him.

Tonight after his shower I again offered him some deodorant. He had already been kind of crabby and we'd been bickering a bit. He made the sarcastic comment that he's sorry that he's not hygienic enough for me. And I got pretty frustrated. I told him that I shouldn't have to walk on eggshells to communicate with him. And that it shouldn't take HIS BOSS telling him that he stinks to do something about it when I tried to help him out with that a few months ago.

He said that I was cruel for using something that he shared with me against him.

Ugh. Can't win.

Am I the asshole in this situation?",25,41,0.93
75,not the a-hole,[deleted],16,47,1.0
76,not the a-hole,"So I met this girl only a few months ago, when she started working at the same place as me. I didn't really think too much of her until we walked home together from work about two weeks ago, and then ended up hanging out at my house twice, her house twice and went for dinner once (all in the past two weeks). Well yesterday I was on a short local hike with my friends and we hadn't made it very far before she started texting me that her mom (we both still live with our parents) was freaking out at her and she needed to see me right away, she seemed really worried at the time. I decided to walk back the trail that we had taken so far and catch the bus to a park near her house, where I met her and she explained that her mom was angry about not rinsing off a plate before she put it in the dishwasher, and began complaining about her broken fingernail and how much it would cost to fix. In that moment in the park, I realized that I didn't actually really want a relationship (with anybody, not necessarily just her), and that I should probably end this before it got more serious between us. I ended up telling her this and that I didn't want to have a girlfriend at the current time in my life. She definitely didn't take it very well, and went silent for a minute before she started questioning me about why I didn't tell her earlier. I didn't really have a good reason (I do feel like the asshole for this) and just ended up leaving and going home. Other than a few texts back and forth we haven't talked, and it's pretty clear that she's still mad at me.

Some extra details I don't know where to fit in:
- She just got from a weekend away and I knew she bought me a T-shirt, which I never ended up recieving from her
- I saw she just posted a brand new pair of mens shoes in my size on a local facebook buy/sell group, that I can only assume were meant to be a gift for me
- She told me earlier that her last ex (from about a month ago) was crazy and angry at her for seemingly no reason, but told me yesterday that she had actually been trying to come see me at work when she was with him and talking about me towards the end of their relationship (this made me feel bad for this guy)

So what do you think reddit? I need your help on this one. If I think of anything else that might be important I'll add it in the comments below.

Also, any advice for what I should do next? We don't go to the same school, except we do work at the same part-time job and I'm worried it will be pretty awkward now to be around her.

Thanks so much everyone.",19,42,1.0
77,everyone sucks,"I have this ""friend"" who we'll call Shawn. Shawn used to be a decent friend and at a time when I was more socially awkward helped me to get a few of my current friends. He even pushed me to ask out my first boyfriend. Fast forward a few years to 12th grade and he's a bit of a micromanaging dick in my life, and inexplicably doesn't trust me to do anything by myself, but I still give him the benefit of the doubt despite everyone else starting to hate him. 

Fast forward again and we're both in different colleges and only see each other when we're on break. Now everytime I see Shawn all he does is talk down to me or try to micromanage the hell out of everything that I do (ex: he can't seem to let go any mistake I make. I trip on the sidewalk and I guess I need fucking crutches now cause he just doesn't let it go and makes me feel like an idiot). He also uses the time to pester me about why I never ask *him* to hang out and why *he* always calls me (spoilers: I don't call anyone ever). Now that we're both on break from college he wants to do something every second we can, and even with friends that don't talk down to me and I like being around I don't want to see very second, so I've taken to just ghosting him because I'm mortified of confrontation.

I feel bad about this but I have a cocktail of mental issues without him, so why should I subject myself to hanging out when I know I'll just be upset afterwards anyway. 

Also to clarify: I have made it obvious, and even flat out told him multiple times, that I don't like having my life micromanaged and he should get off my back a little. 

Edit: I feel like i should clarify that I didn't start ghosting out of the blue. I've been friends with him for years now and tried to cut down on contact, but not before telling him that I don't want to be micromanaged or talked down to. But now I'm at my wits end and short of telling him he's just a terrible friend I don't know what else to do",25,47,0.99
78,asshole,[deleted],29,34,0.91
79,not the a-hole,[deleted],17,83,0.98
80,asshole,[deleted],70,62,0.77
81,not the a-hole,"I've been going out with this girl for 2 years now, and it's gotten to the point where we've talked about marriage, moving out, raising kids, etc…
Were in our mid twenties. I honestly do love her very much, and I can't imagine being with anyone else.

There is one thing, though. I am way more active than she is. I always want to go to shows, go out drinking and go to different events, and she's always tired. I can get her to come out once or twice but if it's two weekends in succession she won't come out. I'm basically going out with a cat. An adorable cat that I can't help fawning over, but is kind of a pain to convince her to be active. I do understand that in relationships you recognise the good and bad in your other half so I don't resent her for not having as much energy as me, not one bit. It's just how she is, and I'm ok with that.  

However, it has an adverse effect on me. I used to be able to get her to come out a lot more, but after a chat I knew she felt I was dragging her all over the place, so I started to go out on my own. When she was in another country for study, she got mad at me for hanging out with a bunch of girls (it's complicated. I put a message up in a group chat and only girls responded and I was in a position where I couldn't call it off.) Just for some drinks and a chat. I can understand that, and learnt my lesson about that. After a while, things settled down and she seemed to be more comfortable with me going out on my own. I became a bit more vocal about it, and she doesnt seem stressed. But all this time I've had a little voice in the back of my mind nagging me that I'm leaving her out. I find myself feeling guilty for not bringing my girlfriend along to social occasions or events, because I'd know shed have fun. 

Today, the line up for this small festival go released and I told my girlfriend I read wanted to go. Last year we went it was only two days but this year it's three. I told her that I had a lot of fun last year and I want to go for the whole thing this year, and she said that last year after two days she was exhausted, and the food was really expensive. She's also not that into music as much as I am, I do freelance work in the industry and run a community. So I suggested that I get the tickets for the whole weekend and I'll get two day tickets for her, she discovered that there arent two day tickets, only one day and the whole weekend. So she said she'll get the whole weekend ticket as well. Bringing into account the stuff she said about last year and our difference in enthusiasm levels towards music, i felt really guilty about it. But if I say ""its ok dont come then"" it night guilt trip her or come across wrong. So...I just don't know what to do now.

So I guess this isnt solely an AITA. 

It's an AITA for going to more events than her, and a kind of ""what should I do"" in the future about these feelings.

Thanks!",24,26,0.88
82,not the a-hole,"Recently my roommate and I threw a party at our place about 25 people most of which were my roommates office mates or are in the same degree. Before the party we talked about if any girls were going to be there because we're both single and he didn't think there would be any single girls there. Early on in the party I was chatting with some random friends of his who I also know. Without knowing he was apparently talking to this one girl. Later I saw this girl and was having a nice conversation with her when my roommate comes up and tells me to back off. I ask if the reason hes telling me is because she has a bf. He said no but he wanted to go after her. I was probably 10 drinks in at this point so I just went back to talking to her. I just enjoyed the conversation I wasn't trying to get laid. Pretty quickly we go and play a game of beer pong and then go and sit and talk on some chairs in the corner. She goes home later in the night and my roommate is pissed at me claiming some foul on my part like I had ""stole his girl"" or something. Its been a couple days since the party and I went on a coffee date with the girl and I enjoyed talking to her even more when we were both sober than when we were hammered. My roommate is still pissed at me though. AITA?
",12,51,0.93
83,not the a-hole,"AITA for being pissed that my(40f) husband(45m) and teenage son (16) did not acknowledge mother's day? 

A little backstory- married 20+ years, our teenage son lives at home, and our 6yo daughter was killed in an accident a few years ago. So needless to say, mother's day is kind of hard for me. 

So, husband and I get up in the morning, no acknowledgement whatsoever of mother's day. No ""Happy Mother's Day"". Literally all I wanted to hear.  I think maybe husband is just waiting for son to get up. Cool, whatever. Son gets up. Again, nothing from his mouth either. Then, the three of us talk about going to my MIL's house to take her HER MOTHER'S DAY present. So, at this point I know that they both know it is mother's day.

On the way to MIL's, we stop by the store so I can go in and get a gift bag for her gift. So, at this point, my husband has access to a store. Just saying. Go to MIL's, and I actually said that I had not gotten a ""Happy Mother's Day"" from either one of them, IN FRONT OF MY SON. Hey said he had to get to work. Ok. Thanks dude. 

Husband was counting on sex last night. Him and I get in the car to leave MIL's, told him it wasn't going to happen because I was pissed. And told him why I was pissed, becuase neither one of them had said ""Happy Mother's Day"". Honestly, that was all I wanted. A card would be the cherry on top. 

Actually, until the last year or two, husband used to be pretty good about acknowledging MD and my birthday. 
But, last fall, on my 40th birthday, husband did nothing. (It's in my comment history.) Seriously hurt my feelings, and I made sure he knew it. So you would think he would at least try. 

But, as the final piece to this little puzzle, I honestly don't know whether I'm overreacting or not. (For the record, I haven't yelled or anything. Said my peace and haven't talked to husband since.) I ran out of my anti-deppresent last week because I forgot to get my refill in time, but I should receive it today. So my emotions are all over the place anyways, and I straight-up bawled for hours last night.

 (I couldn't even call my own mom to tell her HMD, texted her a little stretch of the truth and told her I would talk to her today.

Final note: found a MD card in my purse this morning saying he (husband) had this card, but he was waiting to give it to me, but then ""I decided to hate him"" so he couldn't. I know what kind of cards he usually buys. This was not it. This was one of the last ones on the rack (because I was there hours before and they were pretty much all gone). He grabbed it when he ran out to get himself McDonalds earlier. It seriously isn't the point of the actual card. Still have not the words ""Happy Mother's Day"". Am i being an asshole?",31,79,0.95
84,asshole,[deleted],14,44,0.95
85,not the a-hole,"This post is unconventional but I did something kinda fucked up earlier. There was this giant-ass mosquito in my room and any time I tried to swat it with something it would just fly away, sometimes flying into my face. I opened the windows and doors but it wouldn't leave, even if I tried to chase it out. I had to get creative so I waited for it to be still and i set it on fire with a lighter. It fell immediately and didn't twitch, definitely a fast death. Am I the asshole for defending my domain or is the mosquito the asshole for being a mosquito.",19,52,0.86
