,verdict,body,num_comments,score,upvote_ratio
0,not the a-hole,"So my SIL is about to pop, due any day now. My father's 50th birthday is in 2 weeks, and my fiancé and I will be taking a trip down to celebrate A WEEK BEFORE (keep this in mind it's important). This trip is to a halfway point about 3 hours from where we live, it's a small 2 bedroom hunting cabin that I spent my summers in. There's no cable or WiFi, no cell signal, just you and nature. The cabin is significant to my father and I so we chose there to meet up.

Now. My SIL Mary has been voicing that she wants to go too, which means bringing the baby. While I understand that Baby will be my dad and step mom's first grand kid, I have no desire to be stuck around a screaming infant for 4 days with no relief. Mary and my step brother live within an hour of my parents, they're over there all the time. I kind of want 1 on 1 time with my dad before we move across the country at the end of the month.

Further, my fiancé is not experienced around children, and currently has a low tolerance due to his stress at work. And my step brothers and SIL will be going to the actual birthday party on Dads birthday. AITA for not wanting a weeks-old baby at a small birthday celebration? ",19,61,0.95
1,COMMUNICATE,"A couple years ago I mentioned to my girlfriend in some conversation that I'd be fine with supporting her financially and the like. This was before I even moved out of my parents house and had my own stable income. Now that I've moved out and am living on my own and I've seen that she's not the best with money, I no longer see that as feasible. Over time my opinion changed.

One night she started a fight with me because I didn't buy her a drink after she insisted I buy it for her because it's ""only $1"". She has her own money from her parents and also lives with them. During the fight she went on and told me how I must've ""been lying"" about being fine with supporting her... 2 years ago. I told her that my opinion on that changed and I would expect her to have her own income if we get married

There have been other times too where she tried to hold me to opinions I had two years ago when we first started dating. I find her doing this to be incredibly childish because it's been two years and obviously since I'm now on my own and living in the real world my opinions on certain things change.",19,53,0.92
2,not the a-hole,"I started talking to this girl (we will call her Janice) a week ago, and we seem to hit it off on OKC’s chat. Janice’s profile seemed alright and I found her attractive, and we were both looking for something serious and long term.

The two of us eventually decide that we can meet over the weekend on Sun afternoon. Janice lives 2 hours away from me at a smaller city (I am at one of the bigger cities in the states). So, I decide to make the trip to a public place close to her so we can meet for the very first time in person, because I have friends in a different city not so far away from her. And I was planning to crash at their place for the night since I got Monday off. We also decided early on to not share any personally identifiable info (like last names, phone #s etc.). If we met at a public place at a specified time, it wouldn’t be that difficult to find each other since we know how either of us look like. And OKC’s app can be backup in case plans change last second. I always do that if I am meeting someone new through the interwebs/darkweb, and don’t share those details if both of us are happy with doing so until after the first meet/date.

Ff to last evening, we were chatting and somehow, we end up low-key sexting. We both gave in and did so for a good hour or so, it was hot, and I hate doing so with strangers, but my knees can only take so much. This morning though, Janice starts telling me that she can’t wait till Sun, and clears up Sat (which she was spending with one her friends). I cannot drive over on Sat because I had other errands. Janice is OK with driving over to my city on Sat and that seemed like an OK compromise. But turns out she gets super-anxious driving in big cities with traffic. The thing is most public places are in the heart of the city. Janice suggests if she could drive up to my place and if we could then drive down to the city or take an Uber together. I initially say no, but later end up going along with (even though I hated it). After some time, Janice starts complaining about how she has to drive 4 hours to meet me, and that she wished she had family/friends in the city I live in so she could stay over for the weekend, and that she’d be spending all weekend on the road. And kept doing that every time I tried to talk about something else. I do night shifts, and this really was cutting through my skin of patience, so I tell her that if our date goes well, she’d be more than welcome to crash at my place for the night or the weekend depending on her plans for Sun. That seemed to stop her from complaining. And by stop, I mean just completely stop sending me messages.

I assumed Janice got busy so I took a nap before my classes. I woke up at noon, and got several messages for her with a completely different tone. She called me a creep for trying to bring her to my place for an entire weekend before even meeting her. And doesn’t feel comfortable knowing I am OK with bringing complete strangers to my personal space like that. I re-iterate that I was offering in case she wanted to get some rest, if driving back seems exhausting and only if I feel comfortable with her after meeting her in person. Janice tells me how I am probably just looking for sex and want to force her into sex, and that our height difference makes it easy for me to rape her (she’s more than a foot shorter than me). This infuriated me like crazy because we’ve talked about the height difference before. She was always intimidated by it, and me being bigger than most people didn’t help that matter. I was cranky and groggy because naps are shit and I’ve still got a long day ahead of me. So, I tell her that she does not have to go out to meet someone that she isn’t comfortable. She lashes out further and calls me a dick for saying things she never implied and that I pulled the plug without even trying. That men like me are pigs and like putting their appendages in every hole they desire, regardless of age, gender or consent. I told her I found double-standards annoying earlier and she seemed to use it perfectly to provoke me. I call her the shallowest waste of a hole that no man wants to stick appendages into, yeah I suck at these (I have been told my use of profanity is cringe-worthy so I try not to use it), block her and delete the messages and was in awe how things turned out to be over the course of the week. 

I still don’t understand what I said, implied, assumed or did wrong. I know this story is biased and one-sided but that’s the most objective I can be right.  

Sorry for the long post/rant.",13,37,0.95
3,no a--holes here,"My wife thinks I'm needlessly being an asshole here.

We had a note through the door of our flat a few weeks ago with a little laminated ticket someone had made saying ""resident"" on it. Evidently the resident's committee of the building have decided that they want to keep an eye on who is parking where. I didn't bother putting it on the car because I know everyone (there's 20 flats) and we have a distinctive car that everyone knows is ours, which is always parked in the same spot of an evening because the other spaces are difficult with my wife's mobility issues and the car seat for our son.

Anyway yesterday I spot out the window one of our neighbours examining the car and noting something down on a clipboard. I ask him if he needs any help getting a closer look. He tells me if I don't put the ticket he's made on the car then it'll have to be towed. I tell him I'm not going to bother because everyone knows it's our car, it's in our space, they have no right to tow cars here anyway because there are no parking enforcement signs and that he can get over himself.

He tells me ""Well we've all decided this is what we're doing"" and suggests that we don't have the right to complain because everyone else owns their flat and ours we rent.

I feel that (and my wife agrees) some of the residents are opposed to the flats being let out and that they want to force us out and the owner of ours to sell up. However she thinks I'm being an asshole by not complying with what she rightly points out is a pretty bloody minor demand.

However I feel that if I'm not invited to be a part of the residents' committee and not part of the decision making process and have no contract or agreement with them, they have no right to try and enforce any daft demands on us. I told Mrs andthecircus that I'm nipping it in the bud here by ignoring this rubbish. She'd rather keep the peace.

AITA?

Edit: this isn't one of those ""I need further ammunition"" AITA threads, genuinely grateful for everyone's views. Cheers",34,38,0.94
4,not the a-hole,[deleted],38,31,0.88
5,no a--holes here,[deleted],29,44,0.93
6,not the a-hole,[deleted],13,37,0.93
7,not the a-hole,"I requested four days off of work, months in advance. It wasn't for any good reason, I got tickets to go to SDCC with a friend. I work in fast food and we're always short handed, but that's by design. There's a stack of applications on the desk but the RGM and the supervisor would rather hire very few people and force everyone else to work the jobs of three people so their bonus at the end of the year is bigger. I've also never called out sick before, and the only other time I requested days off was two days when I was part time and I put them in months in advance.

Now, I've worked at this store for nearly a year. It was my first job, and I started out part time. However, I was quickly made full time, and I'm the only full time non manager in the store. Many of the managers have complimented my work ethic. That's not even me tooting my own horn, most of the people we hire do the bare minimum, call out constantly, then finally quit a few months later.

When my manager told me that she probably wouldn't be able to give me my days off I started telling my coworkers that I was searching for another job and would quit  if I didn't get them. I didn't tell her directly, but because fast food is barely a step up from high school in that everyone lives on gossip and drama, I knew she would hear it one way or another. It should also be mentioned that this wasn't a hollow threat, either. I felt entitled to these days. I put in applications elsewhere and brought a letter of resignation with me on the day the schedule came out. This wasn't just over comic con, either, it was a culmination of fast food being a soul sucking hell, shitty managers unwilling to spend money to fix anything (we almost got closed down during our last corporate visit because so many of our machines were broken. They put in no uncertain terms that the reason our score was so low was because of how much shit was broken, but the supervisor bitched at all the employees who did everything right nonetheless), and just a generally shitty work environment. But me not getting those days off would have been the straw that broke the camels back.

Anywho, I know I turned into a bit of a prick at the threat of not getting my days off, but as one of the hardest working people in that store I feel like I deserved a little break. Now that it's over and done with I feel kind of bad for how things played out (not for going to comic con, I had a blast), but it's really not my fault that they fucked themselves over by hiring only a few people and placing a ton of responsibility on minimum wage employees. ",15,39,0.97
8,not the a-hole,[deleted],51,70,0.94
9,not the a-hole,[deleted],14,40,0.95
10,not the a-hole,"So my girlfriend has been working at this new place for 7 months, and at first she really like it, but after a few months the work load increased. She was only contracted for 18 hours part time work a week (as she is a student), but is frequently being kept two hours after work to do things she is neither trained, nor contracted for, and often ends up working a 26+ hour a week.

He sometimes brings her in on Sundays, and after her day at uni has finished on Tuesday, Thursday and Friday.

She doesn't always get paid for these extra hours either, and he keeps no records she was there on those days.

This might be acceptable if she wasn't also a part time student.
To top it off, she has been complaining for the last 3 months or so that her boss is constantly on her case. That he expects more from her than anyone else, and refuses to let her take holidays (that she is legally and contractually entitled too) on the days she wants,and instead just gives her them on random days, when she doesn't want them.

After the 100th complaint about him at dinner, I had enough, and called him up. My GF knew I was going to do it.

My intention was to get him to relent, but I was more than willing to follow through on my threat (see below), as I am financially capable of supporting her for a few months while she gets a new job.

After the usual introductions and why I'm calling, it went a little like this. I (OP), will be 'M'. My GF will be 'GF' and her boss will be 'B'.

M: My girlfriend has been coming home late every evening, she's tired, and when she gets home, she still has two-three hours of studying to work through, and you keep her late every day. She's not allowed to say no, but I can say no. She's not doing that anymore. She's going in on the contracting hours, and leaving on her contracted hours. 18 hours a week. 3 days a week. Monday, Wednesday and Saturday. She won't be coming in on Sundays. She won't come in for 'a few hours' after Uni.

B: You don't have any right to speak to me like that. She will work when I say she works.

M: No. She won't. She will work what her contract says she works. If you want her to work different hours, draft a new contract, which says she will be paid for these hours, and stipulating her new role with these new duties, resulting in better pay. Otherwise she won't be coming in at all. And I will speak to you however I want.

B: Then she won't have a job.

M: Then you won't have a slave to boss around all day with no credit. And I'll be calling the Department for Work and Pensions and telling them of your business practices, if she suffers any negative consequences because of this.

B: ... Tell her I'll discuss this with her tomorrow.

M: I will. But just so you know she will be looking for a new job as of tomorrow. She will continue to do her best for you as she always has, but consider this informal notice of her desire to quit. She will give formal notice when she has a new job.

Hang up

GF, who was sat there listening quietly but not interjecting, told me ""I shouldn't have said that"" and ""It's fine"".

I said I don't think she has to put up with that, and to tell the truth I think she should have stood up for herself weeks ago.

GF: ""I can't get another job like that with those hours""

M: ""You can, there are loads of places. And it was only half serious anyway. You can stay there indefinitely so long as he behaves himself.""

GF: ""What if he fires me?""

M: ""He can't fire you for something someone else did. That's unjust dismissal. And you can take him to Tribunal anyway. He won't risk it""

GF: ""Then what if he just makes it worse""

M: ""Then I call DWP and you quit. I wasn't joking""

The conversation ended there. We didn't really argue but she was definitely in a mood. She was cold in bed that night and she barely said a word to me Sunday.

This was Saturday night. Fast forward to Monday (he didn't call her in Sunday, for a change), and she goes to work. He's fine to her, she arrives on time, and leaves on time, and seems fine when she gets back.

Same yesterday.

But my GF still seems off with me now, Thursday.

I was just trying to help her, because I know she wouldn't have said anything herself because she's not that kind of person and I know her uni work is starting to suffer for it. As is her health. I've never seen her so stressed.
AITA?

TL,DR: My GF boss is an asshole. Makes her work long hours. I call him up for a chat and make him stop being an asshole.


EDIT: I realise today is Wednesday but I drafted this for submission on Thursday *last* week. I just didn't post until now as I wanted to see if she changed. She is still in a mood with me, but it's a lot better.",47,33,0.95
11,not the a-hole,[deleted],17,45,0.96
12,not the a-hole,"Long story short, I live in a 3 bd house with two roommates. Next weekend we have been planning on moving out various large items/cleaning the house/ doing the landscaping before we move out in order to collect our full deposit.

Yesterday one of my roommates said he would be out of town for the weekend (vacation with his girlfriend that was planned after we said we are doing the work weekend) and that when he gets back he'll help out. However, he will only have one day to do it and now it's up to me to find a ""fair"" way to distribute the work, which I think is bullshit. It's a large house, so altogether it's probably 2 full days of work and now on top of that I have to play construction foreman and make sure there's something left for him to do.

On its own, this wouldn't bother me that much. But, and this is a big but, THIS IS THE SECOND YEAR IN A ROW HE HAS DONE THIS! Last year we had the same arrangement, and he went out of town for a week and didn't help at all.

I want to tell him this is bullshit and that he shouldn't be leaving again but he is known to be over sensitive and react poorly to criticism of any kind and I don't want to rock the boat before the three of us live together for another year.

AITA for expecting my roommate to reschedule his vacation to help us this weekend? Or is it fine for me to figure out a way to split the work?",11,37,0.97
13,asshole,"*Note: I haven't done anything yet, and kind of looking for advice as well. Mods please let me know if I should post this in r/Advice instead.*

Backstory: So my mom's side of the family is pretty huge, and pretty religious. I have 8 uncles and aunts, and then comes 30 something cousins. I've never been extremely close with most of this side of the family; I hated going to family gatherings (almost always at my rich doctor uncle's house), and the family would rarely come visit us at our house, one state away, even though we had plenty of room for everyone (2 acres of land with a sizeable 3-level house, can't remember exact sq. footage). So yeah - we'd always have to plan to go about 2 hours away (if I remember correctly) and spend the day there. Not much to do except socialize with cousins, whom I felt were all very much like their parents. Like I said, I was never really close with them and I didn't quite fit in with the family model - religion, college, money, family, kids, etc. The main ones being religion and college I would say, they would always ask about it and I would tell them honestly I had no interest in either. Eventually, I wound up working in the medical cannabis field which really separated me from that side, specifically because that uncle is a doctor and was completely against it. So much so that he was unwilling to let my dying grandma try using it to treat her illness. I have been receiving wedding invites of my cousins, none of whom ever ask me for my address or mention the wedding; I'm assuming they'd ask my mom who would give them my current address and I'd have a wedding invitation waiting for me one day after work. I'd always decline.

Anyway, hope that's enough to give you all an idea.

What I'm wondering is if it's okay for me to basically remove them from my Facebook and any other social media... possibly removing them from my life? I never felt like many of them were ever there for me or cared about what I was doing or interested in. It was just the whole ""family"" aspect of it. Sure, I never took too much of an interest in their lives but I feel like I was fairly honest about how I felt on that regard. I'm not into marriage, religion, college, etc. I know my mom knows how I feel about this, and I think she understands.

Am I an asshole for feeling this way? Let me know if any additional information would help. Any criticism, comments, advice are very welcome. Thanks!",37,32,0.88
14,not the a-hole,[deleted],16,54,0.92
15,asshole,"While my boyfriend and I were walking to drop me off at my yoga class we made plans to meet right after it (he said if he feels well). After yoga ended one of the girls in my class brought out cake so I told my boyfriend I'd be a little late and to not head out yet. He seemed alright with this. After a little bit I told him I'd be heading out soon. The girl brought out more stuff for us so it took us a bit longer. 20 minutes later he messages me to ask if I've headed out yet. I told him no and that I'd head out soon. About 30 minutes later it was over and I told him I headed out. He didn't respond or see the message so I walked 5 minutes to his place and sent him another one.

I told him I was there, and he asked what for because we didn't really confirm it. He told me he was tired and annoyed that I was over an hour late so he didn't feel well enough to go. We fought a bit, I told him to fuck off, and he's been ignoring that message for 30 minutes now.",17,132,0.95
16,frocket,"I was at a party with some friends and I snuck a valiant piece of celery into my mate's frocket. I then bet him $20 that I could sneak another piece into his frocket without him noticing. 

Not 5 minutes later - unbeknownst to him - the celery was snuggled into his frocket. I have multiple witnesses attesting that we did indeed shake on the deal,  that I in fact snuck the celery into his frocket, and that I made it clear this wasn't a joke. Now he refuses to pay me, am I the asshole for wanting my $20?",22,48,0.95
17,not enough info,[deleted],9,44,0.97
18,not the a-hole,"A few weeks ago, I came out as bisexual to my mother. Of course, this took her by surprise, but she told me that she still loves me. I told her because I figured she would handle it well, but she has since become a nervous wreck. She is a devout, but loving Christian, and she tells me to avoid my urges out of fear of me burning in Hell. These past few weeks have been rough on her. She has been losing sleep, her ability to keep up with work has worsened, and she seems to be eating less. However, just now, I was going to bed when I noticed her sitting up in her bed crying her eyes out. She cant take it anymore. I had to sit there with her for 20 minutes while she told me that she thinks that she has failed with me. I'm not ashamed of my sexuality, but I cant help but feel like shit over this. I know I shouldnt feel bad for being honest and open with my mom, but I cant help but feel like I've massively fucked up.",11,49,0.89
19,asshole,"Good Morning! 

So, like the title says- my three nieces (who're like ages 13 and 9 or something IIRC) came down with my mother yesterday when she returned from visiting Hot Springs, AR. 

Let me tell you something about two of these three girls. They suck. So badly. The third isn't terrible only because she's pretty young and not really super cognitive of what's going on around her. Let's call them Molly and Susan for context. 

A little bit of history- I'm 24. I'm adopted. I don't live at home. I DO live in the same city as my family.  My mother has a son from a previous marriage who is ABOUTTT 40ish years old. He's ex military. VERY much a southern man living in Ft. Worth. He has the traditional nuclear family. Three daughters. A dog. A wife. A chevy. And him and I NEVER were on the same page until I was about 17-18. He always teased me about being a little more feminine (I'm gay) He wasn't particularly warm. The only real reason we're any closer now is because he apologized for not being very ""brotherly"" my whole childhood. 

Additionally- my mother does this shit where she'll put words in people's mouths and then swear to god she's telling the truth. For context, if I don't come rushing over to her home the first chance I get to see my awful spoiled rotten nieces then I'm ""breaking their hearts because ALL THEY WANT is to be able to see their uncle Youngaydult! It's ALLLL they've talked about"" (none of which is true). 

The major problem though is these girls are SO negative and unable to keep themselves from saying the first negative thing that comes to mind. 

""Why does your hair look like that?""
""Why does your face look the way it looks?""
""Why do you shorts come above your knee? You're boy""
""Why do your nipples poke through your shirt""  
""Why do you drink?""

It's like every time I'm in the room some critical analysis needs to be conducted of why I'm the way I am and what's worse is the same huge question is always promoted; ""Why don't you ever come over when we're here? Why don't you like us""

...? Like... it's not rocket science to me. Maybe it's ridiculous that a 24 year old is so insecure that the words of a child can dent my ego so badly but I just would rather not be around it. I tried to explain it to my mother but she doesn't get it and is afraid if she says anything it'll result in her granddaughters not wanting to see her. 

So- to me it's just better to stay at arms length. AITA?


",22,41,0.93
20,not the a-hole,[deleted],15,43,0.96
